District Name,NCES District ID,State District ID,Mailing Address,Physical Address,Phone,Type,Status,Total Schools,Website
Redding STEM Academy District,0601595,CA-0132944,"3711 Oasis RD.Redding, CA 96003-0397","3711 Oasis RD.Redding, CA 96003-0397",(530)275-5480,Independent charter district,Open,1,http://www.rstem.org
Redlands Unified,0632070,CA-3667843,"Po Box 3008Redlands, CA 92373-1508","20 W. Lugonia AVE.Redlands, CA 92374-2234",(909)307-5300,Regular local school district,Open,25,http://www.redlands.k12.ca.us
Redondo Beach Unified,0600032,CA-1975341,"1401 Inglewood AVE.Redondo Beach, CA 90278-3999","1401 Inglewood AVE.Redondo Beach, CA 90278-3999",(310)379-5449,Regular local school district,Open,14,http://www.rbusd.org
Redwood Academy of Ukiah District,0601610,CA-2330413,"1059 N. State ST.Ukiah, CA 95482-3413","1059 N. State ST.Ukiah, CA 95482-3413",(707)467-0500,Independent charter district,Open,1,http://www.caredwoods.org
Redwood City Elementary,0632130,CA-4169005,"750 Bradford ST.Redwood City, CA 94063-1727","750 Bradford ST.Redwood City, CA 94063-1727",(650)482-2200,Regular local school district,Open,12,http://www.rcsd.k12.ca.us
Redwood Coast Montessori District,0601922,CA-0137653,"Po Box 6103Eureka, CA 95502","1611 Peninsula DR.Manila, CA 95521-9658",(707)832-4194,Independent charter district,Open,1,http://www.redwoodcoastmontessori.org
Redwood Preparatory Charter District,0601995,CA-0124164,"1480 Ross Hill RD.Fortuna, CA 95540-3433","1480 Ross Hill RD.Fortuna, CA 95540-3433",(707)682-6149,Independent charter district,Open,1,http://redwoodprep.org
Reed Union Elementary,0632160,CA-2165425,"277-a Karen WayTiburon, CA 94920","277-a Karen WayTiburon, CA 94920",(415)381-1112,Regular local school district,Open,3,http://www.reedschools.org
Reeds Creek Elementary,0632250,CA-5271647,"18335 Johnson RD.Red Bluff, CA 96080-9467","18335 Johnson RD.Red Bluff, CA 96080-9467",(530)527-6006,Regular local school district,Open,1,http://www.reedscreek.org
Reef-Sunset Unified,0632270,CA-1673932,"205 N. Park AVE.Avenal, CA 93204-1425","205 N. Park AVE.Avenal, CA 93204-1425",(559)386-9083,Regular local school district,Open,9,http://www.rsusd.org
Renaissance Arts Academy District,0601766,CA-0101683,"2558 N. San Fernando RD.Los Angeles, CA 90065-1324","2558 N. San Fernando RD.Los Angeles, CA 90065-1324",(323)259-5700,Independent charter district,Open,1,http://renarts.org
Rescue Union Elementary,0632310,CA-0961978,"2390 Bass Lake RD.Rescue, CA 95672-9608","2390 Bass Lake RD.Rescue, CA 95672-9608",(530)677-4461,Regular local school district,Open,7,http://www.rescueusd.org
Rialto Unified,0632370,CA-3667850,"182 E. Walnut AVE.Rialto, CA 92376-3530","182 E. Walnut AVE.Rialto, CA 92376-3530",(909)820-7700,Regular local school district,Open,30,http://kec.rialto.k12.ca.us/
Richfield Elementary,0632400,CA-5271654,"23875 River RD.Corning, CA 96021-9771","23875 River RD.Corning, CA 96021-9771",(530)824-3354,Regular local school district,Open,1,http://www.richfieldschool.org
Richgrove Elementary,0632430,CA-5472082,"Po Box 540Richgrove, CA 93261-0540","20812 Grove DR.Richgrove, CA 93261-0540",(661)725-2424,Regular local school district,Open,1,http://www.richgrove.org
Richland Union Elementary,0621450,CA-1563578,"331 N. Shafter AVE.Shafter, CA 93263-1967","300 N. ValleyShafter, CA 93263-1967",(661)746-8600,Regular local school district,Open,4,http://www.rsdshafter.org
Richmond Charter Academy District,0602121,CA-0126805,"1450 Marina Way S.Richmond, CA 94804-1718","1450 Marina Way S.Richmond, CA 94804-1718",(510)235-2465,Independent charter district,Open,1,http://www.amethodschools.org
Richmond Charter Elementary-Benito Juarez District,0601670,CA-0129643,"1450 Marina Way S.Richmond, CA 94804-1534","1450 Marina Way S.Richmond, CA 94804-1534",(510)215-7009,Independent charter district,Open,1,http://www.amethodschools.org
Richmond College Preparatory District,0601722,CA-0110973,"Po Box 2814Richmond, CA 94802-2814","214 S. 11th ST.Richmond, CA 94804-2474",(510)235-2066,Independent charter district,Open,1,http://www.rcpschools.org/
Richmond Elementary,0632520,CA-1864170,"700-585 Richmond RD. E.Susanville, CA 96130-5026","700-585 Richmond RD. E.Susanville, CA 96130-5026",(530)257-2338,Regular local school district,Open,1,http://www.richmondelementary.com
Ridgecrest Elem Acad for Language Music and Sci District,0601931,CA-1530500,"325 S. Downs ST.Ridgecrest, CA 93555-4531","325 S. Downs ST.Ridgecrest, CA 93555-4531",(760)375-1010,Independent charter district,Open,1,http://www.rcrealms.org
Rim of the World Unified,0632610,CA-3667868,"Po Box 430Lake Arrowhead, CA 92352-0430","24740 San Moritz WayCrestline, CA 92325",(909)336-2031,Regular local school district,Open,7,http://www.rimsd.k12.ca.us
Rincon Valley Union Elementary,0632640,CA-4970896,"1000 Yulupa AVE.Santa Rosa, CA 95405-7020","1000 Yulupa AVE.Santa Rosa, CA 95405-7020",(707)542-7375,Regular local school district,Open,9,http://www.rvusd.org
Rio Bravo-Greeley Union Elementary,0632710,CA-1573544,"6521 Enos LN.Bakersfield, CA 93314-8721","6521 Enos LN.Bakersfield, CA 93314-8721",(661)589-2696,Regular local school district,Open,2,http://www.rbgusd.k12.ca.us
Rio Dell Elementary,0632730,CA-1263008,"95 Center ST.Rio Dell, CA 95562-1323","95 Center ST.Rio Dell, CA 95562-1323",(707)764-5694,Regular local school district,Open,2,http://www.riodellschools.net
Rio Elementary,0632760,CA-5672561,"1800 Solar DR.Oxnard, CA 93030-2655","1800 Solar DR.Oxnard, CA 93030-2655",(805)485-3111,Regular local school district,Open,9,http://www.rioschools.org
Rio Valley Charter District,0601765,CA-0122580,"1110 W. Kettleman DR. STE. 10Lodi, CA 95240-6602","1110 W. Kettleman DR. STE. 10Lodi, CA 95240-6602",(209)368-4934,Independent charter district,Open,1,http://www.riovalley.org
Ripon Unified,0632880,CA-3968650,"304 N. Acacia AVE.Ripon, CA 95366-2404","304 N. Acacia AVE.Ripon, CA 95366-2404",(209)599-2131,Regular local school district,Open,7,http://www.riponusd.net
Rise Kohyang Elementary District,0601721,CA-0136994,"600 S. La Fayette Park PL.Los Angeles, CA 90057","600 S. La Fayette Park PL.Los Angeles, CA 90057-3243",(213)224-8900,Independent charter district,Open,1,http://www.brightstarschools.org/rkes
Rise Kohyang High District,0601946,CA-0133868,"600 S. Lafayette Park PL.Los Angeles, CA 90057","600 S. Lafayette Park PL.Los Angeles, CA 90057",(323)284-2553,Independent charter district,Open,1,http://brightstarschools.org/rkhs
Rise Kohyang Middle District,0601723,CA-0124222,"600 S. La Fayette Park PL. - Third FL.Los Angeles, CA 90057","3020 Wilshire BLVD. 2nd FL.Los Angeles, CA 90013-1120",(424)789-8338,Independent charter district,Open,1,http://www.brightstarschools.org/rkms
Rising Sun Montessori District,0601868,CA-0129965,"4940 Robert J. Mathews PKWY.El Dorado Hills, CA 95762-5721","4940 Robert J. Mathews PKWY.El Dorado Hills, CA 95762-5721",(916)936-2333,Independent charter district,Open,1,http://www.risingsunmontessori.org
River Charter Schools Lighthouse Charter District,0602314,CA-0131706,"Po Box 303Clarksburg, CA 95612","899 Bryte AVE.West Sacramento, CA 95605",(916)744-1212,Independent charter district,Open,1,http://www.lighthousecharterschool.org
River Delta Joint Unified,0633110,CA-3467413,"445 Montezuma ST.Rio Vista, CA 94571-1651","445 Montezuma ST.Rio Vista, CA 94571-1651",(707)374-1700,Regular local school district,Open,11,http://www.riverdelta.org
River Islands High District,0602574,CA-0141242,"1175 Commercial ST.Lathrop, CA 95330","2760 Penrose LN.Lathrop, CA 95330",(209)717-6715,Independent charter district,New,1,School District Demographic Dashboard
River Islands Technology Academy II District,0601756,CA-0127134,"1175 Marina DR.Lathrop, CA 95330-8543","1175 Marina DR.Lathrop, CA 95330-8543",(209)229-4700,Independent charter district,Open,1,http://www.riverislandsacademy.net
River Montessori Elementary Charter District,0602204,CA-0119750,"3880 Cypress DR. STE. BPetaluma, CA 94954-5613","3880 Cypress DR. STE. BPetaluma, CA 94954-5613",(707)778-6414,Independent charter district,Open,1,http://www.rivermontessoricharter.org
River Oak Charter District,0602414,CA-0115055,"555 Leslie ST.Ukiah, CA 95482-5507","555 Leslie ST.Ukiah, CA 95482-5507",(707)467-1855,Independent charter district,Open,1,http://www.riveroakcharterschool.org
River Oaks Academy District,0601908,CA-0122713,"920 Hampshire RD. STE. XWestlake Village, CA 91361-2865","920 Hampshire RD. STE. XWestlake Village, CA 91361-2865",(805)777-7999,Independent charter district,Open,1,School District Demographic Dashboard
River Springs Charter District,0602089,CA-0110833,"27740 Jefferson AVE.Temecula, CA 92590-2698","27740 Jefferson AVE.Temecula, CA 92590-2698",(951)252-8800,Independent charter district,Open,1,http://springscharterschools.org
River Valley Charter District,0601462,CA-3731072,"9707 1/2 Marilla DR.Lakeside, CA 92040-2868","9707 1/2 Marilla DR.Lakeside, CA 92040-2868",(619)390-2579,Independent charter district,Open,1,http://www.rivervalleyhigh.org
Riverbank Unified,0600061,CA-5075556,"6715 Seventh ST.Riverbank, CA 95367-2345","6715 Seventh ST.Riverbank, CA 95367-2345",(209)869-2538,Regular local school district,Open,6,http://www.riverbank.k12.ca.us
Riverdale Joint Unified,0600040,CA-1075408,"Po Box 1058Riverdale, CA 93656-1058","3160 W. MT. Whitney AVE.Riverdale, CA 93656-9272",(559)867-8200,Regular local school district,Open,4,http://www.rjusd.org
Riverside County Office of Education,0691026,CA-3310330,"Po Box 868Riverside, CA 92502-0868","3939 13th ST.Riverside, CA 92502-0868",(951)826-6530,Regular local school district,Open,5,http://www.rcoe.us
Riverside County Office Of Education ROP,0600094,CA-3374492,"3939 13th ST.Riverside, CA 92502","3939 13th ST.Riverside, CA 92502",(909)826-6797,Specialized public school district,Open,1,School District Demographic Dashboard
Riverside Preparatory District,0602566,CA-0113928,"Po Box 386Oro Grande, CA 92368","19121 Third ST.Oro Grande, CA 92368",(760)243-5884,Independent charter district,Open,1,http://www.riversideprep.net
Riverside Unified,0633150,CA-3367215,"Po Box 2800Riverside, CA 92516-2800","3380 14th ST.Riverside, CA 92501-3810",(951)788-7135,Regular local school district,Open,49,http://www.riversideunified.org
Roberts Ferry Union Elementary,0633210,CA-5071233,"101 Roberts Ferry RdWaterford, CA 95386-9501","101 Roberts Ferry RdWaterford, CA 95386-9501",(209)874-2331,Regular local school district,Open,2,http://www.robertsferry.k12.ca.us
Robla Elementary,0633240,CA-3467421,"5248 Rose ST.Sacramento, CA 95838-1633","5248 Rose ST.Sacramento, CA 95838-1633",(916)649-5248,Regular local school district,Open,6,http://www.robla.k12.ca.us
Rocketship Academy Brilliant Minds District,0601848,CA-0125781,"350 Twin Dolphin DR. STE. 109Redwood City, CA 94065","2960 Story RD.San Jose, CA 95116-3925",(877)806-0920,Independent charter district,Open,1,http://www.rocketshipschools.org/schools/brilliant
Rocketship Alma Academy District,0601637,CA-0125799,"350 Twin Dolphin DR. STE. 109Redwood City, CA 94065","198 W. Alma AVE.San Jose, CA 95110-3631",(877)806-0920,Independent charter district,Open,1,http://www.rocketshipschools.org/schools/alma-acad
Rocketship Delta Prep District,0602286,CA-0137430,"350 Twin Dolphin Dr Ste 109Redwood City, CA 94065","1700 Cavallo RD.Antioch, CA 94509-1930",(877)806-0920,Independent charter district,Open,1,http://www.rocketshipschools.org/schools/deltaprep
Rocketship Discovery Prep District,0601621,CA-0123281,"350 Twin Dolphin DR. STE. 109Redwood City, CA 94065","370 Wooster ST.San Jose, CA 95116-1095",(877)806-0920,Independent charter district,Open,1,http://www.rocketshipschools.org/schools/discovery
Rocketship Fuerza Community Prep District,0602379,CA-0131110,"350 Twin Dolphin DR.Redwood City, CA 95110","70 S. Jackson AVE.San Jose, CA 95116-2506",(877)806-0920,Independent charter district,Open,1,http://www.rocketshipschools.org/schools/fuerza-co
Rocketship Futuro Academy District,0602162,CA-0134072,"350 Twin Dolphin DR.Redwood City, CA 94065","2351 Olivera RD.Concord, CA 94520-1626",(925)246-5537,Independent charter district,Open,1,http://www.rocketshipschools.org/schools/futuro-ac
Rocketship Los Suenos Academy District,0602191,CA-0120642,"350 Twin Dolphin DR. STE. 109Redwood City, CA 94065","331 S. 34th ST.San Jose, CA 95116-2905",(877)806-0920,Independent charter district,Open,1,http://www.rocketshipschools.org/schools/los-sueno
Rocketship Mateo Sheedy Elementary District,0601782,CA-0113704,"350 Twin Dolphin DR. STE. 109Redwood City, CA 94065","788 Locust ST.San Jose, CA 95110-2954",(877)806-0920,Independent charter district,Open,1,http://www.rocketshipschools.org/schools/mateo-she
Rocketship Mosaic Elementary District,0602444,CA-0123299,"350 Twin Dolphin DR. STE. 109Redwood City, CA 94065","950 Owsley AVE.San Jose, CA 95122-3109",(877)806-0920,Independent charter district,Open,1,http://www.rocketshipschools.org/schools/mosaic-el
Rocketship Redwood City District,0601793,CA-0132076,"350 Twin Dolphin DR. STE. 109Redwood City, CA 94065","909 Roosevelt AveRedwood City, CA 94061-2558",(877)806-0920,Independent charter district,Open,1,http://www.rsed.org
Rocketship Rising Stars District,0601729,CA-0133496,"350 Twin Dolphin DR. STE. 109Redwood City, CA 94065","3173 Senter RD.San Jose, CA 95111-1332",(877)806-0920,Independent charter district,Open,1,http://www.rocketshipschools.org/schools/rising-st
Rocketship Si Se Puede Academy District,0601536,CA-0119024,"350 Twin Dolphin DR. STE. 109Redwood City, CA 94065","2249 Dobern AVE.San Jose, CA 95116-3405",(877)806-0920,Independent charter district,Open,1,http://www.rocketshipschools.org/schools/si-se-pue
Rocketship Spark Academy District,0602087,CA-0128108,"350 Twin Dolphin DR. STE. 109Redwood City, CA 94065","683 Sylvandale AVE.San Jose, CA 95111-1414",(877)806-0920,Independent charter district,Open,1,http://www.rocketshipschools.org/schools/spark-aca
Rockford Elementary,0633270,CA-5472090,"14983 RD. 208Porterville, CA 93257-9318","14983 RD. 208Porterville, CA 93257-9318",(559)784-5406,Regular local school district,Open,1,http://www.tcoe.net/districts/rockford.shtm
Rocklin Academy at Meyers Street District,0601674,CA-0114371,"6532 Turnstone WayRocklin, CA 95765-5865","6532 Turnstone WayRocklin, CA 95765-5865",(916)632-6580,Independent charter district,Open,1,http://www.rocklinacademy.org
Rocklin Academy District,0602312,CA-6118392,"6532 Turnstone WayRocklin, CA 95765-5865","6532 Turnstone WayRocklin, CA 95765-5865",(916)632-6580,Independent charter district,Open,1,http://www.rocklinacademy.org
Rocklin Academy Gateway District,0602268,CA-0127928,"6550 Lonetree BLVD.Rocklin, CA 95765-5874","6550 Lonetree BLVD.Rocklin, CA 95765-5874",(916)778-4550,Independent charter district,Open,1,http://www.rocklinacademy.com
Rocklin Unified,0600013,CA-3175085,"2615 Sierra Meadows DR.Rocklin, CA 95677-2126","2615 Sierra Meadows DR.Rocklin, CA 95677-2126",(916)624-2428,Regular local school district,Open,18,http://www.rocklinusd.org
Rocky Point Charter District,0602463,CA-0113407,"3500 Tamarack DR.Redding, CA 96003-1747","3500 Tamarack DR.Redding, CA 96003-1747",(530)225-0456,Independent charter district,Open,1,http://www.rockypointcharter.com
Romoland Elementary,0633390,CA-3367231,"25900 Leon RdHomeland, CA 92548-9141","25900 Leon RdHomeland, CA 92548-9141",(951)926-9244,Regular local school district,Open,6,http://www.romoland.net
Rosedale Union Elementary,0633480,CA-1563750,"2553 Old Farm RD.Bakersfield, CA 93312-3531","2553 Old Farm RD.Bakersfield, CA 93312-3531",(661)588-6000,Regular local school district,Open,9,http://www.ruesd.net
Roseland,0633510,CA-4970904,"1691 Burbank AVE.Santa Rosa, CA 95407-7433","1691 Burbank AVE.Santa Rosa, CA 95407-7433",(707)545-0102,Regular local school district,Open,3,http://www.roselandsd.org
Roseland Charter District,0602334,CA-0101923,"1691 Burbank AVE.Santa Rosa, CA 95407-6928","1691 Burbank AVE.Santa Rosa, CA 95407-6928",(707)545-0102,Independent charter district,Open,1,http://www.roselandsd.org
Rosemead Elementary,0633570,CA-1964931,"3907 Rosemead BLVD.Rosemead, CA 91770-2041","3907 Rosemead BLVD.Rosemead, CA 91770-2041",(626)312-2900,Regular local school district,Open,5,http://www.rosemead.k12.ca.us
Roseville City Elementary,0633600,CA-3166910,"1050 Main ST.Roseville, CA 95678-2067","1050 Main ST.Roseville, CA 95678-2067",(916)771-1600,Regular local school district,Open,20,http://www.rcsdk8.org
Roseville Joint Union High,0633630,CA-3166928,"1750 Cirby WayRoseville, CA 95661-5520","1750 Cirby WayRoseville, CA 95661-5520",(916)786-2051,Regular local school district,Open,8,http://www.rjuhsd.us
Ross Elementary,0633660,CA-2165433,"Po Box 1058Ross, CA 94957-1058","9 Lagunitas RD.Ross, CA 94957-1058",(415)457-2705,Regular local school district,Open,1,http://www.rossbears.org
Ross Valley Charter District,0602234,CA-0135350,"102 Marinda DR.Fairfax, CA 94930-1105","102 Marinda DR.Fairfax, CA 94930-1105",(415)534-6970,Independent charter district,Open,1,http://www.rossvalleycharter.org
Ross Valley Elementary,0600006,CA-2175002,"110 Shaw DR.San Anselmo, CA 94960-1112","110 Shaw DR.San Anselmo, CA 94960-1112",(415)454-2162,Regular local school district,Open,5,http://www.rossvalleyschools.org
Round Valley Joint Elementary,0633690,CA-1463305,"300 N. Round Valley RD.Bishop, CA 93514-9632","300 N. Round Valley RD.Bishop, CA 93514-9632",(760)387-2525,Regular local school district,Open,1,http://rvjesd-ca.schoolloop.com/
Round Valley Unified,0633720,CA-2365607,"Po Box 276Covelo, CA 95428-0276","76280 High Sch ST.Covelo, CA 95428-0276",(707)983-6171,Regular local school district,Open,3,http://www.roundvalleyschools.org/
Rowland Unified,0633750,CA-1973452,"1830 S. Nogales ST.Rowland Heights, CA 91748-2945","1830 S. Nogales ST.Rowland Heights, CA 91748-2945",(626)965-2541,Regular local school district,Open,23,http://www.rowlandschools.org
Sacramento Charter High District,0602303,CA-0102038,"Po Box 5038Sacramento, CA 95817","2315 34th ST.Sacramento, CA 95820-1211",(916)277-6200,Independent charter district,Open,1,http://www.sachigh.org
Sacramento City Unified,0633840,CA-3467439,"Po Box 246870Sacramento, CA 95824-6870","5735 47th AVE.Sacramento, CA 95824-4528",(916)643-9000,Regular local school district,Open,73,http://www.scusd.edu
Sacramento County Office of Education,0691027,CA-3410348,"Po Box 269003Sacramento, CA 95826-9003","10474 Mather BLVD.Mather, CA 95655-4116",(916)228-2500,Regular local school district,Open,6,http://www.scoe.net
Sacramento County ROP,0600095,CA-3474500,"10541 Norden AVE.Mather, CA 95655","10541 Norden AVE.Mather, CA 95655",(916)228-2463,Specialized public school district,Open,1,School District Demographic Dashboard
Sacramento Valley Charter District,0602065,CA-0124875,"2301 Evergreen AVE.West Sacramento, CA 95691-3009","2399 Sellers WayWest Sacramento, CA 95691-3046",(916)596-6422,Independent charter district,Open,1,http://www.sacvalleycharter.org
Saddleback Valley Unified,0633860,CA-3073635,"25631 Peter A. Hartman WayMission Viejo, CA 92691-3142","25631 Peter A. Hartman WayMission Viejo, CA 92691-3142",(949)586-1234,Regular local school district,Open,34,http://www.svusd.k12.ca.us
Sage Oak Charter - South District,0602505,CA-0139378,"1473 Ford ST.Redlands, CA 92373-3913","1473 Ford ST.Redlands, CA 92373-3913",(888)435-4445,Independent charter district,Open,1,http://www.sageoak.education
Saint Helena Unified,0637830,CA-2866290,"465 Main ST.ST. Helena, CA 94574-2159","465 Main ST.ST. Helena, CA 94574-2159",(707)967-2708,Regular local school district,Open,4,http://www.sthelenaunified.org
Salida Union Elementary,0633900,CA-5071266,"4801 Sisk RD.Salida, CA 95368-9226","4801 Sisk RD.Salida, CA 95368-9226",(209)545-0339,Regular local school district,Open,5,http://www.salida.k12.ca.us
Salinas City Elementary,0633930,CA-2766142,"840 S. Main ST.Salinas, CA 93901-1624","840 S. Main ST.Salinas, CA 93901-1624",(831)753-5600,Regular local school district,Open,15,http://www.salinascity.k12.ca.us/
Salinas Union High,0633980,CA-2766159,"431 W. Alisal ST.Salinas, CA 93901-1624","431 W. Alisal ST.Salinas, CA 93901-1624",(831)796-7000,Regular local school district,Open,12,http://www.salinasuhsd.org/
Samueli Academy District,0602051,CA-0126037,"1901 N. Fairview ST.Santa Ana, CA 92706-2205","1901 N. Fairview ST.Santa Ana, CA 92706-2205",(714)619-0245,Independent charter district,Open,1,http://www.samueliacademy.org/
San Antonio ROP,0600114,CA-1974849,"605 N. Park AVE.Pomona, CA 91768","605 N. Park AVE.Pomona, CA 91768",(909)469-2304,Specialized public school district,Open,1,School District Demographic Dashboard
San Antonio Union Elementary,0634050,CA-2766167,"Po Box 5000Lockwood, CA 93932-5000","67550 Lockwood/jolon RD.Lockwood, CA 93932-5000",(831)385-3051,Regular local school district,Open,1,http://www.sanantoniousd.org
San Ardo Union Elementary,0634080,CA-2766175,"Po Box 170San Ardo, CA 93450-0170","62428 Center ST.San Ardo, CA 93450-0170",(831)627-2520,Regular local school district,Open,1,http://sausd-k12-pt.schoolloop.com/
San Benito County Office of Education,0691028,CA-3510355,"460 Fifth ST.Hollister, CA 95023-3841","460 Fifth ST.Hollister, CA 95023-3841",(831)637-5393,Regular local school district,Open,4,http://www.sbcoe.org
San Benito High,0634140,CA-3567538,"1220 Monterey ST.Hollister, CA 95023-4708","1220 Monterey ST.Hollister, CA 95023-4708",(831)637-5831,Regular local school district,Open,2,http://www.sbhsd.k12.ca.us
San Bernardino City Unified,0634170,CA-3667876,"777 N. F ST.San Bernardino, CA 92410-3017","777 N. F ST.San Bernardino, CA 92410-3017",(909)381-1100,Regular local school district,Open,76,http://www.sbcusd.com
San Bernardino County Office of Education,0691029,CA-3610363,"601 N. E ST.San Bernardino, CA 92415-0020","601 N. E ST.San Bernardino, CA 92415-0020",(909)386-2704,Regular local school district,Open,3,http://www.sbcss.k12.ca.us
San Bernardino County ROP,0600132,CA-3674518,"670 E. Carnegie DR.San Bernardino, CA 92408","670 E. Carnegie DR.San Bernardino, CA 92408",(909)252-4559,Specialized public school district,Open,1,School District Demographic Dashboard
San Bruno Park Elementary,0634230,CA-4169013,"500 Acacia AveSan Bruno, CA 94066-4298","500 Acacia AveSan Bruno, CA 94066-4298",(650)624-3101,Regular local school district,Open,6,http://www.sbpsd.org
San Carlos Charter Learning Center District,0601842,CA-6112213,"750 Dartmouth AVE.San Carlos, CA 94070-3802","750 Dartmouth AVE.San Carlos, CA 94070-3802",(650)508-7343,Independent charter district,Open,1,http://www.scclc.net
San Carlos Elementary,0634290,CA-4169021,"1200 Industrial RD. Unit 9San Carlos, CA 94070-4129","1200 Industrial RD. Unit 9San Carlos, CA 94070-4129",(650)508-7333,Regular local school district,Open,9,http://www.scsdk8.org/
San Diego Cooperative Charter District,0601809,CA-6119168,"7260 Linda Vista RD.San Diego, CA 92111-6128","7260 Linda Vista RD.San Diego, CA 92111-6128",(858)496-1613,Independent charter district,Open,1,http://www.sdccs.org
San Diego County Office of Education,0691030,CA-3710371,"6401 Linda Vista RD.San Diego, CA 92111-7319","6401 Linda Vista RD.San Diego, CA 92111-7319",(858)292-3500,Regular local school district,Open,8,http://www.sdcoe.net
San Diego County ROP,0600138,CA-3774526,"6401 Linda Vista RD.San Diego, CA 92111","6401 Linda Vista RD.San Diego, CA 92111",(858)292-3500,Specialized public school district,Open,1,http://www.sdcoe.net
San Diego Mission Academy District,0602294,CA-0138651,"9512 Chesapeake DR.San Diego, CA 92123-1305","30951 Highway 79Warner Springs, CA 92086-1305",(833)772-5106,Independent charter district,Open,1,http://sdmissionacademy.org
San Diego Unified,0634320,CA-3768338,"4100 Normal ST.San Diego, CA 92103-2682","4100 Normal ST.San Diego, CA 92103-2682",(619)725-8000,Regular local school district,Open,175,http://www.sandi.net
San Diego Virtual District,0601893,CA-0123224,"Po Box 602060San Diego, CA 92160-3848","2878 Camino Del Rio S. STE. 410San Diego, CA 92108-3848",(619)713-7271,Independent charter district,Open,1,School District Demographic Dashboard
San Diego Workforce Innovation High District,0602108,CA-0134890,"2 Euclid AVE.National City, CA 91950-1967","2 Euclid AVE.National City, CA 91950-1967",(619)432-4690,Independent charter district,Open,1,http://www.innovationsandiego.org
San Dieguito Union High,0634380,CA-3768346,"710 Encinitas BLVD.Encinitas, CA 92024-3357","710 Encinitas BLVD.Encinitas, CA 92024-3357",(760)753-6491,Regular local school district,Open,10,http://www.sduhsd.net
San Francisco County Office of Education,0691111,CA-3810389,"555 Franklin ST.San Francisco, CA 94102-5207","555 Franklin ST.San Francisco, CA 94102-5207",(415)241-6000,Regular local school district,Open,4,http://www.sfusd.edu/
San Francisco County ROP,0600139,CA-3874534,"555 Franklin ST.San Francisco, CA 94102","555 Franklin ST.San Francisco, CA 94102",(415)241-6121,Specialized public school district,Open,1,School District Demographic Dashboard
San Francisco Unified,0634410,CA-3868478,"555 Franklin ST.San Francisco, CA 94102-5207","555 Franklin ST.San Francisco, CA 94102-5207",(415)241-6000,Regular local school district,Open,113,http://www.sfusd.edu
San Gabriel Unified,0634425,CA-1975291,"408 Junipero Serra DR.San Gabriel, CA 91776-4500","408 Junipero Serra DR.San Gabriel, CA 91776-4500",(626)451-5400,Regular local school district,Open,8,http://www.sgusd.k12.ca.us
